id,wer,pred_transcription,time
5142-33396-0000,0.13496280552603612," At another time Harold asked, What is your country, Olaf? Have you always been a thrall? The thrall's eyes flashed. Two hundred warriors feasted in his hall and followed him to battle. The rest of you off a Viking. He had three ships. These he gave to three of my brothers. But I stayed that spring and built me a boat. I made her for only twenty oars because I thought few men would follow me, for I was young, fifteen years old. I painted the eyes red for anger. There, stand so, I said, and glare and hiss at my foes. In the stern I carved the tail up almost as high as the head. There she sat on the rollers, as fair a ship as I ever saw. Then I will get me a farm, and we'll winter in that land. Now who will follow me? He is but a boy, the man said. Thirty men, one after another, raised their horns and said, As our boat flashed down the rollers into the water, I made this song and sang it. So we harried the coast of Norway. We ate at many men's tables uninvited. My dragon's belly is never full, and on board went the gold. Oh, it is better to live on the sea and let other men raise your crops and cook your meals. A house smells of smoke, a ship smells of frolic. Up and down the water we went, to get much wealth and much frolic. What of the farm, Olaf? Not yet, I answered. Viking is better for summer. It was so dark that I could see nothing but a few sparks on the hearth. I stood with my back to the wall. for I wanted no sword reaching out of the dark for me. Come, come, I called, when no one obeyed. A fire! My men laughed. Yes, a stingy host! He acts as though he had not expected us. On a bench in a far corner were a dozen people huddled together. Bring in the table! We are hungry! The thralls were bringing in a great pot of meat. They set up a crane over the fire and hung the pot upon it, and we sat and watched it boil while we joked. At last the supper began. The farmer sat gloomily on the bench and would not eat, and you cannot wonder, for he saw us putting potfuls of his good beef and basket loads of bread into our big mouths. You would not eat with us. You cannot say no to half of my ale. I drink this to your health. Then I drank half of the hornful and set the rest across the fire to the farmer. He took it and smiled, saying, Did you ever have such a lordly guest before? i went on so i will give out this law that my men shall never leave you alone hawk in there shall be your constant companion friend farmer he shall not leave you day or night whether you are working or playing or sleeping i named nine others and said and these shall follow your thralls in the same way so i set guards over everyone in that house so no tails got out to the neighbors besides it was a lonely place and by good luck no one came that way Their eyes danced. Big Torleaf stood up and stretched himself. I'm stiff with long sitting, he said. I itch for a fight. I turned to the farmer. This is our last feast with you, I said. By the beard of Odin, I cried, you have taken our joke like a man. My men pounded the table with their fists. By the hammer of Thor, shouted Grimm, there is no stingy coward. Here, friend, take it, and he thrust it into the farmer's hand. May you drink heart's ease from it for many years, and with it I leave you a name, Sif the Friendly. I shall hope to drink with you sometime in Valhalla. Here is a ring for Sif the Friendly, and here is a bracelet, and a sword would not be ashamed to hang at your side. I took five great bracelets of gold from our treasure chest and gave them to him. That is the best way to decide, for the spear will always point somewhere, and one thing is as good as another. That time it pointed us into your father's ships. Here, they said, is a rascal who has been harrying our coasts. We sunk his ship and men, but him we brought to you. A robber viking, said the king, and he scowled at me. Yes, and with all your fingers it took you a year to catch me. The king frowned more angrily. Take him out, Torkel, and let him taste your sword. Your mother, the queen, was standing by. Now she put her hand on his arm and smiled and said, And would he not be a good gift for our baby? your father thought a moment then looked at your mother and smiled soft heart he said gently to her then to torkel well let him go torkel then he turned to me again frowning but young sharp-tongue now that we have caught you we will put you into a trap that you cannot get out of so i lived and now i am your tooth-thrall well it is the luck of war",7.593939542770386
3570-5696-0000,0.049315068493150684," Under the simple test of effectiveness for advertising, we should expect to find leisure and the conspicuous consumption of goods dividing the field of pecuniary emulation pretty evenly between them at the outset. But the actual course of development has been somewhat different from this ideal scheme. Leisure held the first place at the start and came to hold a rank very much above wasteful consumption of goods, both as a direct exponent of wealth and as an element in the standard of decency during the quasi-peaceful culture. Other circumstances permitting, that instinct disposes men to look with favour upon productive efficiency and on whatever is of human use. A reconciliation between the two conflicting requirements is effected by a resort to make-believe. Many an intricate polite observances and social duties of a ceremonial nature are developed. Many organizations are founded, with some specious object of amelioration embodied in their official style and title. There is much coming and going, and a deal of talk, to the end that the talkies may not have occasion to reflect on what is the effectual economic value of their traffic. The salient features of this development of domestic service have already been indicated. Throughout the entire evolution of conspicuous expenditure, whether of goods or of services or human life, runs the obvious implication that in order to effectually mend the consumer's good fame, it must be an expenditure of superfluities. As used in the speech of everyday life, the word carries an undertone of deprecation. The use of the word waste as a technical term, therefore, implies no deprecation of the motives or of the ends sought by the consumer under this canon of conspicuous waste. But it is on other grounds worth noting that the term waste in the language of everyday life implies deprecation of what is characterized as wasteful. In strict accuracy, nothing should be included under the head of conspicuous waste but such expenditure as is incurred on the ground of an invidious pecuniary comparison. An article may be useful and wasteful both, and its utility to the consumer may be made up of use and waste in the most varying proportions.",2.600346565246582
4507-16021-0000,0.20693391115926327," CHAPTER I. ORIGIN. Thus, idleness is the mother. She has a son, theft, and a daughter, hunger. What is slang? We have never understood this sort of objections. Slang is odious. Slang makes one shudder. Who denies that? Of course it does. When it is a question of probing a wound, a gulf, a society since when has it been considered wrong to go too far to go to the bottom we have always thought that it was sometimes a courageous act and at least a simple and useful deed worthy of the sympathetic attention which duty accepted in fulfilled merits why should one not explore everything and study everything why should one halt on the way nothing is more lugubrious than the contemplation thus in its nudity in the broad light of thought of the horrible swarming of slang now when has horror ever excluded study since when has malady banished medicine can one imagine a naturalist refusing to study the viper the bat the scorpion the centipede the tarantula and one who would cast them back into their darkness saying oh how ugly that is he would be like a philologist refusing to examine a fact in language a philosopher hesitating to scrutinize a fact in humanity we may be stopped the fact may be put to us in general terms which is one way of attenuating it we may be told that all trades professions it may be added all the accidents of the social hierarchy and all forms of intelligence have their own slang the painter who says my grinder the notary who says my skip the gutter the hairdresser who says my mealy back the cobbler who says my cub talks slang the sugar manufacturer who says loaf clarified lumps bastard common burnt this honest manufacturer talks slang To meet the needs of this conflict, wretchedness has invented a language of combat which is slang. To keep afloat and to rescue from oblivion, to hold above the gulf, were it but a fragment of some language which man has spoken and which would otherwise be lost, or by which it is complicated to extend the records of social observation is to serve civilization itself even dialect let that pass to this we reply in one word only assuredly if the tongue which a nation or a province has spoken is worthy of interest the language which has been spoken by a misery is still more worthy of attention and study and then we insist upon it the study of social deformities and infirmities and the task of pointing them out with a view to remedy is not a business in which choice is permitted he must descend with his heart full of charity and severity at the same time as a brother and as a judge to those impenetrable casemates where crawl pell-mell those who bleed and those who deal the blow, those who weep and those who curse, those who fast and those who devour, those who endure evil and those who inflict it. Do we really know the mountain well when we are not acquainted with the cavern? they constitute two different orders of facts which correspond to each other which are always interlaced and which often bring forth results true history being a mixture of all things the true historian mingles in everything facts form one of these and ideas the other There it clothes itself in word masks, in metaphor rags, in this guise, it becomes horrible. One perceives, without understanding it, a hideous murmur, sounding almost like human accents, but more nearly resembling a howl than an articulate word. One thinks one hears hydras talking. it is unintelligible in the dark it is black in misfortune it is blacker still in crime these two blacknesses amalgamated compose slang the earth is not devoid of resemblance to a jail look closely at life it is so made that everywhere we feel the sense of punishment Each day has its own great grief for its little care. Yesterday you were trembling for a health that is dear to you. Today you fear for your own. Tomorrow it will be anxiety about money. The day after, tomorrow the diatribe of a slanderer. The day after that, the misfortune of some friend. Then the prevailing weather. Then something that has been broken or lost, then a pleasure with which your conscience and your vertebral column reproach you. Again, the course of public affairs, this without reckoning in the pains of the heart, and so it goes on. There is hardly one day out of a hundred which is wholly joyous and sunny, and you belong to that small class who are happy? In this world, evidently the vestibule of another, there are no fortunate. The real human division is this, the luminous and the shady. To diminish the number of the shady, to augment the number of the luminous, that is the object. That is why we cry education, science. To teach reading means to light the fire. Every syllable spelled out sparkles. However, he who says light does not necessarily say joy. People suffer in the light. Excess burns. The flame is the enemy of the wing. To burn without ceasing to fly. Therein lies the marvel of genius.",10.287532329559326
8555-284449-0000,0.20245398773006135," So they were quite willing to obey the orders of their girl queen, and in a short time the blast of trumpets and roll of drums and clashing of cymbals told Trot and Captain Bill that the blue bands had assembled before the palace. Then they all marched out a little way into the fields, and found that the army of pinkies had already formed, and was advancing steadily toward them. At the head of the pinkies were Gipka Sizzle and Button Bright, who had the parrot on his shoulder. and they were supported by Captain Coralie, and Captain Tintant, and Rosalie the Witch. When the blueskin saw Gipka Sizzle, they raised another great shout, for he was the favorite of the soldiers, and very popular with all the people. Since last Thursday, I, Gipka Sizzle, have been the lawful Boolaroo of the blue country, but now that you are conquered by Queen Trot, I suppose I am conquered too, and you have no Boolaroo at all. when he finished she said cheerfully don't worry sizzle dear it'll all come right pretty soon now then let's enter the city and enjoy the great feast that's being cooked i'm nearly starving myself for this conquering kingdoms is hard work then she gave rosalie back her magic ring thanking the kind witch for all she had done for them you are her mate replied the sailor it will be such a satisfaction The guards had a terrible struggle with the goat, which was loose in the room, and still wanted to fight, but finally they subdued the animal, and then they took the boularoo out of the frame who was tied in, and brought both him and the goat before Queen Trot, who awaited them in the throne room of the palace. I'll gladly do that, promised the new boularoo, and I'll feed the honorable goat all the shavings and leather and tin cans he can eat, besides the grass. ""'Excuse me,' said Trot. ""'I neglected to tell you that you're not the Boolaroo anymore.' ""'The former Boolaroo groaned. ""'I'll not be wicked anymore,' sighed the old Boolaroo. ""'I'll reform. ""'As a private citizen, I shall be a model of deportment, ""'because it would be dangerous to be otherwise.' when first they entered the throne room they tried to be as haughty and scornful as ever but the blues who were assembled there all laughed at them and jeered them for there was not a single person in all the blue country who loved the princesses the least little bit so gipka sizzle ordered the captain to take a file of soldiers and escort the raving beauties to their new home that evening trot gave a grand ball in the palace to which the most important of the pinkies and the blueskins were invited the combined bands of both the countries played the music and a fine supper was served",3.6433584690093994
8555-284447-0000,0.28371278458844135," then he rushed downstairs into the courtyard shouting loudly for his soldiers and threatening to patch everybody in his dominions if the sailorman was not recaptured hold him fast my men and as soon as i've had my coffee and oatmeal i'll take him to the room of the great knife and patch him i wouldn't mind a cup of coffee myself said cap'n bill i've had considerable exercise this morning and i'm all ready for breakfast but cap'n bill made no such attempt knowing it would be useless as soon as they entered the room of the great knife the buleroo gave a yell of disappointment the room of the great knife was high and big and around it ran rows of benches for the spectators to sit upon in one place at the head of the room was a raised platform for the royal family with elegant throne chairs for the king and queen and six smaller but richly upholstered chairs for the snow-nosed princesses therefore her majesty paid no attention to any one and no one paid any attention to her rich jewels of blue stones glittered upon new persons and the royal ladies were fully as gorgeous as they were haughty and overbearing morning girls hope you feel as well as you look control yourselves my dears replied the the worst punishment i know how to inflict on any one this prisoner is about to suffer you will see a very pretty patching my royal daughters suppose it's a friend the captain shook his head why you said to fetch the first living creature we met and that was the spilligoat replied the captain panting hard as he held fast to one of the goat's horns the idea of patching cap'n bill to a goat was vastly amusing to him and the more he thought of it the more he roared with laughter they look something alike you know suggested the captain of the guards looking from one to the other doubtfully and they're nearly the same size if you stand the boat on his hind legs they've both got the same style of whiskers and they're both of them obstinate and dangerous so they ought to make a good patch splendid fine glorious When this had been accomplished, the Bularoo leaned over to try to discover why the frame rolled away, seemingly of its own accord, and he was the more puzzled, because it had never done such a thing before. At once the goat gave a leap, escaped from the soldiers, and with bowed head rushed upon the Bularoo. Before any could stop him, he butted his majesty so furiously that the king soared far into the air, and tumbled in a heap among the benches, where he lay moaning and groaning. the goat's warlike spirit was roused by this successful attack then they sped in great haste for the door and the goat gave a final butt that sent the row of royal ladies all diving into the corridor in another tangle whereupon they shrieked in a manner that terrified everyone within sound of their voices she said going toward the benches",4.046208620071411
7021-79759-0000,0.5901639344262295, nature of the effect produced by early impressions that is comparatively nothing they are chiefly formed from combinations of the impressions made in childhood vast importance and influence of this mental furnishing as well as on the principles of action in mature years must be exerted by the nature and character of the images which the period of infancy and childhood impress upon the mind,1.0857040882110596
2094-142345-0000,0.2269197584124245," It is a very fine old place of red brick, softened by a pale, powdery lichen, which has dispersed itself with happy irregularity, so as to bring the red brick into terms of friendly companionship with the limestone ornaments surrounding the three gables, the windows, and the doorplace. But the windows are patched with wooden panes, and the door, I think, is like the gate. it is never opened for it is a solid heavy handsome door and must once have been in the habit of shutting with a sonorous bang behind the liveried lackey who had just seen his master and mistress off the grounds in a carriage and pair some empty corn bags and what through the left hand window several clothes horses a pillion a spinning wheel and an old box wide open and stuffed full of colored rags at the edge of this box there lies a great wooden doll which so far as mutilation is concerned bears a strong resemblance to the finest greek sculpture and especially in the total loss of its nose the history of the house is plain now but there is always a stronger sense of life when the sun is brilliant after rain and now he is pouring down his beams and making sparkles among the wet straw and lighting up every patch of vivid green moss on the red tiles of the cowshed and turning even the muddy water that is hurrying along the channel to the drain into a mirror for the yellow billed ducks who are seizing the opportunity of getting a drink with as much body in it as possible for the great barn doors are thrown wide open and men are busy there mending the harness under the superintendence of mr goby the whittah otherwise saddler who entertains them with the latest treadleston gossip when her aunt's back was turned, of looking at the pleasing reflection of herself in those polished services. For the oak table was usually turned up like a screen and was more for ornament than for use. And she could see herself sometimes in the great round pewter dishes that were arranged on the shelves above the long deal dinner table, or in the hobs of the grate, which always shone like Jasper. The family likeness between her and her niece dinah morris with the contrast between her keenness and dinah's seraphic gentleness of expression might have served a painter as an excellent suggestion for a martha and mary her tongue was not less keen than her eye and whenever a damsel came within earshot seemed to take up an unfinished lecture as a barrel organ takes up a tune precisely at the point where it had left off to all appearance molly had got through her after-dinner work in an exemplary manner had cleaned herself with great dispatch and now came to ask submissively if she should sit down to her spinning till milking time that's the road you'd all like to go headlongs to ruin mr oatley's indeed you are a rare'un for sitting down to your work a little while after it's time to put by money my iron's twight told please put it down to warm cold is it my darling bless your sweet face she's going to put the ironing things away money i did like to do into the barn to tommy to see the toddy however had descended from her chair with great swiftness and was already in retreat towards the dairy with a sort of waddling run and an amount of fat on the nape of her neck which made her look like the metamorphosis of a white suckling pig and she was very fond of you too aunt rachel i often heard her talk of you in the same sort of way when she had that bad illness and i was only eleven years old she used to say you'll have a friend on earth in your aunt rachel if I'm taken from you, for she has a kind heart, and I'm sure I've found it so. And there's linen in the house, as I could well spare you, for I got lots of sheeting and table clothing and toweling as isn't made up. But not more than what's in the Bible, Aunt, said Dinah. Nay, dear Aunt, you never heard me say that all people are called to forsake their work and their families. We can all be servants of God, wherever our lot is cast. but he gives us different sorts of work according as he fits us for it and calls us to it i can no more help spending my life in trying to do what i can for the souls of others than you could help running if you heard little toddy crying at the other end of the house the voice would go to your heart you would think the dear child was in trouble or in danger and you couldn't rest without running to help her and comfort her I have strong assurance that no evil will happen to you and my uncle and the children from anything I have done. I didn't preach without direction. Direction! I had a common patience with you. By this time the two gentlemen had reached the palings and had got down from their horses. It was plain they meant to come in, said Mr. Irwin, with his stately cordiality. I delight in your kitchen. Poyser is not at home, is he? ""'said Captain Donnythorne, ""'seating himself where he could see ""'along the short passage to the open dairy door. ""'No, sir, he isn't. ""'He's gone to Rossiter to see Mr. West, ""'the factor, about the wool. ""'No, thank you. ""'I'll just look at the whelps ""'and leave a message about them with your shepherd. ""'I must come another day and see your husband. ""'I want to have a consultation with him about horses, ""'for if he's anywhere on the farm ""'we can send for him in a minute.' ""'But you know more about that than I do, sir. ""'I think I should be doing you a service ""'to turn you out of such a place. ""'I know his farm is in better order ""'than any other within ten miles of us. ""'And as for the kitchen,' he added, smiling, ""'I don't believe there's one in the kingdom to beat it. ""'Oh, I've no doubt it's in capital order.'",11.021959066390991
