id,wer,pred_transcription,time
2830-3980-0000,0.07360861759425494," In every way, they sought to undermine the authority of St. Paul. They said to the Galatians, You have no right to think highly of Paul. He was the last to turn to Christ. Paul came later and is beneath us. Indeed, he persecuted the Church of Christ for a long time. Do you suppose that God, for the sake of a few Lutheran heretics, would disown his entire Church? Against these boasting false apostles, Paul boldly defends his apostolic authority in ministry. as the ambassador of a government is honored for his office and not for his private person so the minister of christ should exalt his office in order to gain authority among men paul takes pride in his ministry not to his own praise but to the praise of god either he calls ministers through the agency of men or he calls them directly as he called the prophets and apostles paul declares that the false apostles were called or sent neither by men nor by man The most they could claim is that they were sent by others. He mentions the apostles first because they were appointed directly by God. The call is not to be taken lightly. For a person to possess knowledge is not enough. It spoils one's best work. When I was a young man, I thought Paul was making too much of his call. I did not then realize the importance of the ministry. I knew nothing of the doctrine of faith because we were taught sophistry instead of certainty, and nobody understood spiritual boasting. This is no sinful pride, it is holy pride. And God the Father who raised him from the dead. The clause seems superfluous on first sight. These perverters of the righteousness of Christ resist the Father and the Son and the works of them both. In this whole epistle, Paul treats of the resurrection of Christ. By his resurrection, Christ won the victory over law, sin, flesh, world, devil, death, hell, and every evil. Verse 2. and all the brethren which are with me. This should go far in shutting the mouths of the false apostles. Although the brethren with me are not apostles like myself, yet they are all of one mind with me, think, write, and teach as I do. They do not go where the enemies of the gospel predominate. They go where the Christians are. Why do they not invade the Catholic provinces and preach their doctrine to godless princes, bishops, and doctors, as we have done by the help of God? We look for that reward which eye hath not seen, nor ear heard, neither hath entered into the heart of man. Not all the Galatians had become perverted. These means cannot be contaminated. They remain divine regardless of men's opinion. Wherever the means of grace are found, there is the Holy Church, even though Antichrist reigns there. So much for the title of the epistle now follows the greeting of the Apostle. Verse 3 Grace be to you, and peace from God the Father, and from our Lord Jesus Christ. The terms of grace and peace are common terms with Paul, and are now pretty well understood. The greeting of the Apostle is refreshing. Grace involves the remission of sins, peace, and a happy conscience. The world brands this a pernicious doctrine. Experience proves this. However, the grace and peace of God will. Men should not speculate about the nature of God. Was it not enough to save from God the Father? To do so is to lose God altogether because God becomes intolerable when we seek to measure and to comprehend His infinite majesty. He came down to earth, lived among men, suffered, was crucified, and then he died, standing clearly before us, so that our hearts and eyes may fasten upon him. Embrace him, and forget about the nature of God. Did not Christ himself say, I am the way, and the truth, and the life? No man cometh unto the Father but by me? When you argue about the nature of God, apart from the question of justification, you may be as profound as you like. We are to hear Christ, who has been appointed by the Father as our divine teacher. At the same time, Paul confirms our creed that Christ is very God. That Christ is very God is apparent in that Paul ascribes to him divine powers equally with the Father, as, for instance, the power to dispense grace and peace. To bestow peace and grace lies in the province of God, who alone can create these blessings. The angels cannot. Otherwise, Paul should have written, Grace from God the Father and peace from our Lord Jesus Christ. The Arians took Christ for a noble and perfect creature, superior even to the angels, because by him God created heaven and earth. Muhammad also speaks highly of Christ. Paul sticks to his theme. He never loses sight of the purpose of his epistle. Not gold or silver or paschal lambs or an angel, but himself. What for? Not for a crown, or a kingdom, or our goodness, but for our sins. Underscore these words, for they are full of comfort for sore consciences. How may we obtain remission of our sins? Paul answers, the man who is named Jesus Christ and the Son of God gave himself for our sins. Since Christ was given for our sins, it stands to reason that they cannot be put away by our own efforts. This sentence also defines our sins as great, so great, in fact, that the whole world could not make amends for a single sin. The greatness of the ransom, Christ, the Son of God, indicates this. The vicious character of sin is brought out by the words, who gave himself for our sins. But we are careless. We make light of sin. We think that by some little work or merit we can dismiss sin. This passage, then, bears out the fact that all men are sold under sin. This attitude springs from a false conception of sin, the conception that sin is a small matter, easily taken care of by good works, that we must present ourselves unto God with a good conscience, that we must feel no sin before we may feel that Christ was given for our sins. This attitude is universal and particularly developed in those who consider themselves better than others. But the real significance and comfort of the words, for our sins, is lost upon them. On the other hand, we are not to regard them as so terrible that we must despair.",12.256773710250854
4446-2275-0000,0.078125," The stop at Queenstown, the tedious passage up the Mercy, were things that he noted dimly through his growing impatience. She blushed and smiled and fumbled his card in her confusion before she ran upstairs. Alexander paced up and down the hallway, buttoning and unbuttoning his overcoat, until she returned and took him up to Hilda's living room. The room was empty when he entered. ""'Alexander did not sit down. ""'I felt it in my bones when I woke this morning ""'that something splendid was going to turn up. ""'I thought it might be Sister Kate or Cousin Mike ""'would be happening along. ""'She pushed him toward the big chair by the fire ""'and sat down on a stool at the opposite side of the hearth, ""'her knees drawn up to her chin, ""'laughing like a happy little girl. ""'When did you come, Bartley, and how did it happen? ""'You haven't spoken a word.' ""'I got in about ten minutes ago.' ""'Alexander leaned forward and warmed his hands before the blaze. Bartley bent lowered over the fire. She looked at his heavy shoulders and big, determined head, thrust forward like a catapult in leash. ""'I'll do anything you wish me to, Bartley,' she said tremulously. ""'I can't stand seeing you miserable.' He pulled up a window as if the air were heavy. Hilda watched him from the corner, trembling and scarcely breathing, dark shadows growing about her eyes. ""'But it's worse now. It's unbearable. I get nothing but misery out of either.' The world is all there, just as it used to be, but I can't get at it any more. It was myself I was defying Hilda. Hilda's face quivered, but she whispered, Yes, I think it must have been. But why didn't you tell me when you were here in the summer? Alexander groaned. I meant to, but somehow I couldn't. She pressed his hand gently in gratitude. Weren't you happy then, at all? She closed her eyes and took a deep breath, as if to draw in again the fragrance of those days. He moved uneasily, and his chair creaked. Yes, yes, she hurried, pulling her hand gently away from him. Please tell me one thing, Bartley. At least tell me that you believe I thought I was making you happy. Yes, Hilda, I know that, he said simply. I understand, Bartley. I was wrong, but I didn't know. You've only to tell me now. What I mean is that I want you to promise never to see me again, no matter how often I come, no matter how hard I beg. Keep away if you wish. When have I ever followed you? Alexander rose and shook himself angrily. Yes, I know I'm cowardly. He took her roughly in his arms. Do you know what I mean? Oh, Bartley, what am I to do? I will ask the least imaginable, but I must have something. I must know about you. ""'The sight of you, Bartley, to see you living and happy and successful, can I never make you understand what that means to me? You see, loving someone as I love you makes the whole world different. And then you came back, not caring very much, but it made no difference.' Bartley bent over and took her in his arms, kissing her mouth and her wet, tired eyes. ""'Don't cry, don't cry,' he whispered. ""'We've tortured each other enough for to-night.'",5.224049806594849
2961-960-0000,0.1484375," he passes abruptly from persons to ideas and numbers and from ideas and numbers to persons from the heavens to man from astronomy to physiology he confuses or rather does not distinguish subject and object first and final causes and is dreaming of geometrical figures lost in a flux of sense the influence which the timaeus has exercised upon posterity is due partly to a misunderstanding in the supposed depths of this dialogue the neoplatonists found hidden meanings in connections with the jewish and christian scriptures and out of them they elicited doctrines quite at variance with the spirit of plato they were absorbed in his theology and were under the dominion of his name while that which was truly great and truly characteristic in him his effort to realize and connect abstractions was not understood by them at all there is no danger of the modern commentators on the timaeus falling into the absurdities of the neoplatonists in the present day we are well aware that an ancient philosopher is to be interpreted from himself and by the contemporary history of thought the fancies of the neoplatonists are only interesting to us because they exhibit a phase of the human mind which prevailed widely in the first centuries of the christian era and is not wholly extinct in our own day but they have nothing to do with the interpretation of plato and in spirit they are we do not know how plato would have arranged his own dialogues or whether the thought of arranging any of them besides the two trilogies which he has expressly connected was ever present to his mind the dialogue is primarily concerned with the animal creation including under this term the heavenly bodies and with man only as one among the animals but he has not as yet defined this intermediate territory which lies somewhere between medicine and mathematics and he would have felt that there was as great an impiety in ranking theories of physics first in the order of knowledge as in placing the body before the soul with heraclitus he acknowledges the perpetual flux like an exagoras he asserts the predominance of mind although admitting an element of necessity which reason is incapable of subduing like the pythagoreans he supposes the mystery of the world to be contained in number many if not all the elements of the pre-socratic philosophy are included in the timaeus It is probable that the relation of the ideas to God or of God to the world was differently conceived by him at different times of his life. The ideas also remain, but they have become types in nature, forms of men, animals, birds, fishes. The style and plan of the Tineas differ greatly from that of any other of the Platonic dialogues. but plato has not the same mastery over his instrument which he exhibits in the phaedrus or symposium nothing can exceed the beauty or art of the introduction in which he is using words after his accustomed manner but in the rest of the work the power of language seems to fail him and the dramatic form is wholly given up he could write in one style but not in another and the greek language has not as yet been fashioned by any poet or philosopher to describe physical phenomena and hence we find the same sort of clumsiness in the timaeus of plato which characterizes the philosophical poem of lucretius there is a want of flow and often a defect of rhythm the meaning is sometimes obscure and there is a greater use of apposition and more of repetition than occurs in plato's earlier writings plato had not the command of his materials which would have enabled him to produce a perfect work of art",5.2199273109436035
5639-40744-0000,0.1449056603773585," Eleven o'clock had struck. It was a fine, clear night. They were the only persons on the road. And they sauntered leisurely along, to avoid paying the price of fatigue for the recreation provided for the Toledans in the valley or on the banks of their river. Secure, as he thought, in the careful administration of justice in that city, and the character of its well-disposed inhabitants, the good Hidalgo was far from thinking that any disaster could befall his family. rudolfo and his companions with their faces muffled in their cloaks stared rudely and insolently at the mother the daughter and the servant-maid in a moment he communicated his thoughts to his companions and in the next moment they resolved to turn back and carry her off to please rudolfo for the rich who are open-handed always find parasites ready to encourage their bad propensities and thus to conceive this wicked design to communicate it approve it, resolve on Ravish and Laocadia, and to carry that design into effect was the work of a moment. They drew their swords, hid their faces in the flaps of their cloaks, turned back, and soon came in front of the little party, who had not yet done giving thanks to God for their escape from those audacious men. Finally the one party went off exalting, and the other was left in and Leocadia's parents reached theirs, heartbroken and despairing. Meanwhile, Rudolfo had Leocadia safe in his custody, and in his own apartment. Who touches me? Am I in bed? Mother, dear father, do you hear me? It is the only amends I ask of you for the wrong you have done me. She found the door, but it was locked outside. She succeeded in opening the window, and the moonlight shone in so brightly that she could distinguish the color of some damask hanging in the room. she saw that the bed was gilded and so rich that it seemed that of a prince rather than of a private gentleman among other things on which she cast her eyes was a small crucifix of solid silver standing on a cabinet near the window this person was rudolpho who though he had gone to look for his friends had changed his mind in that respect not thinking it advisable to acquaint them with what had passed between him and the girl on the contrary he resolved to tell them that repenting of his violence and moved by her tears he had only carried her half way towards his house and then let her go choking with emotion leocadia made a sign to her parents that she wished to be alone with them that would be very well my child replied her father if your plan were not liable to be frustrated by ordinary cunning but no doubt this image had been already missed by its owner and he will have set it down for certain that it was taken out of the room by the person he locked up there what you had best do my child is to keep it and pray to it that since it was a witness to your undoing it will deign to vindicate your cause by its righteous judgment thus did the humane and right-minded father comfort his unhappy daughter and her mother, embracing her again, did all she could to soothe the feelings. She, meanwhile, passed her life with her parents in the strictest retirement, never letting herself be seen, but shunning every eye lest it should read her misfortune in her face. Time rolled on. The hour of her delivery arrived. It took place in the utmost secrecy, her mother taking upon her the office of midwife, as she gave birth to a son, one of the most beautiful ever seen. when the boy walked through the streets blessings were showered upon him by all who saw him blessing upon his beauty upon the mother that bore him upon the father that begot him upon those who brought him up so well one day when the boy was sent by his grandfather with a message to a relation he passed along a street in which there was a great concourse of horsemen the bed she too well remembered was there and above all the cabinet on which had stood the image she had taken away was still on the same spot. Louis was out of danger in a fortnight. In a month he rose from his bed, and during all that time he was visited daily by his mother and grandmother, and treated by the master and mistress of the house as if he was their own child. This truth, which I have learned from her lips, is confirmed by his face, in which we have both beheld that of our son. Just then Leocadia came to herself. And embracing the cross seemed changed into a sea of tears, and the gentleman remaining in utter bewilderment, until his wife had repeated to him, from beginning to end, Leocadia's whole story, and he believed it, through the blessed dispensation of heaven which had confirmed it by so many convincing testimonies. So persuasive were her entreaties, and so strong her assurances that no harm whatever could result to them, from the information she sought. they were induced to confess that one summer's night the same she had mentioned themselves and another friend being out on a stroll with rodolpho they had been concerned in the abduction of a girl whom rodolpho carried off whilst the rest of them detained her family who made a great outcry and would have defended her if they could for god's sake my lady mother give me a wife who would be an agreeable companion not one who will disgust me, so that we may both bear evenly and with mutual goodwill, the yoke imposed on us by heaven, instead of pulling this way and that way, and fretting each other to death. Her bearing was graceful and animated. She led her son by the hand, and before her walked two maids, with wax lights and silver candlesticks. All rose to do her reverence, as if something from heaven had miraculously appeared before them. but gazing on her entranced with admiration not one of them was able to address a single word to her she reflected how near she stood to the crisis which was to determine whether she was to be blessed or unhappy for ever and racked by the intensity of her emotions she suddenly changed color her head dropped and she fell forward in a swoon into the arms of the dismayed estephania his mother had left her to him as being her destined protector but when she saw that he too was insensible she was near making a third and would have done so had he not come to himself know then son of my heart that this fainting lady is your real bride i say real because she is the one whom your father and i have chosen for you and the portrait was a pretense just at the moment when the tears of the pitying beholders flowed fastest and their ejaculations were most expressive of despair leocadia gave signs of recovery and brought back gladness to the hearts of all this was done for the event took place at a time when the consent of the parties was sufficient for the celebration of a marriage without any of the preliminary formalities which are now so properly required nor was rodolpho less surprised than they and the better to assure himself of so wonderful a fact he begged leocadia to give him some token which should make perfectly clear to him that which indeed he did not doubt, since it was authenticated by his parents.",11.118462324142456
1284-1181-0000,0.15673289183222958," ojo examined this curious contrivance with wonder margolot had first made the girl's form from the patchwork quilt and then she had dressed it with a patchwork skirt and an apron with pockets in it using the same gay material throughout the head of the patchwork girl was the most curious part of her the hair was of brown yarn and hung down on her neck in several neat braids gold is the most common metal in the land of oz and is used for many purposes because it is soft and pliable no i forgot all about the brains exclaimed the woman well that may be true agreed margolot but on the contrary a servant with too much brains is sure to become independent and high and mighty and feel above her work she poured into the dish a quantity from each of these bottles I think that will do, she continued, for the other qualities are not needed in a servant. She ran to her husband's side at once, and helped him lift the four kettles from the fire. Their contents had all boiled away, leaving in the bottom of each kettle a few grains of fine white powder. Very carefully the magician removed this powder, placing it all together in a golden dish, where he mixed it with a golden spoon. no one saw him do this for all were looking at the powder of life but soon the woman remembered what she had been doing and came back to the cupboard ojo became a bit uneasy at this for he had already put quite a lot of the cleverness powder in the dish but he dared not interfere and so he comforted himself with the thought that one cannot have too much cleverness he selected a small gold bottle with a pepper-box top so that the powder might be sprinkled on any object through the small holes most people talk too much so it is a relief to find one who talks too little i am not allowed to perform magic except for my own amusement he told his visitors as he lighted a pipe with a crooked stem and began to smoke the wizard of oz who used to be a humbug and knew no magic at all has been taking lessons of glinda and i'm told he is getting to be a pretty good wizard but he is nearly the assistant of the great sorceress it truly is asserted the magician i now use them as ornamental statuary in my garden dear me what a chatterbox you're getting to be onk remarked the magician who was pleased with the compliment asked the voice in scornful accents",2.7800655364990234
121-127105-0000,0.18478260869565216," It was this observation that drew from Douglas, not immediately, but later in the evening, a reply that had the interesting consequence to which I call attention. Someone else told a story not particularly effective, which I saw he was not following, cried one of the women. He took no notice of her. He looked at me, but as if, instead of me, he saw what he spoke of. There was a unanimous groan at this, and much reproach, after which, in his preoccupied way, he explained, The story's written. I could write to my man and enclose the key. He could send down the packet as he finds it. The others resented postponement, but it was just his scruples that charmed me. To this his answer was prompt. Oh, thank God, no. And is the record yours? ""'She would have been worthy of any whatever. ""'It wasn't simply that she said so, but that I knew she hadn't. ""'I was sure. I could see. ""'You'll easily judge why when you hear. ""'Because the thing had been such a scare?' ""'He continued to fix me. ""'You are acute.' ""'He quitted the fire and dropped back into his chair. ""'Probably not till the second post. ""'It was almost the tone of hope. ""'Everybody will stay,' cried the ladies, whose departure had been fixed. ""'Who was it she was in love with?' the story will tell i took upon myself to reply oh i can't wait for the story the story won't tell said douglas not in any literal vulgar way more's the pity then won't you tell douglas well if i don't know who she was in love with i know who he was let me say here distinctly to have done with it that this narrative from an exact transcript of my own made much later is what i shall presently give poor douglas before his death when it was in sight committed to me the manuscript that reached him on the third of these days and that on the same spot with immense effect he began to read to our hushed little circle on the night of the fourth the departing ladies who had said they would stay didn't of course thank heaven stay they departed in consequence of arrangements made in a rage of curiosity as they professed produced by the touches with which he had already worked us up. The first of these touches conveyed that the written statement took up the tale at a point after it had, in a manner, begun. He had for his own town residence a big house filled with the spoils of travel and the trophies of the chase. But it was to his country home, an old family place in Essex, that he wished her immediately to proceed. The awkward thing was that they had practically no other relations. and that his own affairs took up all his time. There were plenty of people to help, but of course the young lady who should go down as governess would be in supreme authority. I don't anticipate. She was young, untried, nervous. It was a vision of serious duties and little company, of really great loneliness. Yes, but that's just the beauty of her passion. It was the beauty of it. It sounded dull, but sounded strange, and all the more so because of his main condition, which was, she promised to do this, and she mentioned to me that when for a moment, disburdened, delighted, he held her hand, thanking her for the sacrifice, she already felt rewarded. But was that all her reward? one of the ladies asked.",5.309452295303345
