id,wer,pred_transcription,time
1188-133604-0000,0.11516155758077878," You will find me continually speaking of four men, Titian, Holbein, Turner, and Tintoret, in almost the same terms. They unite every quality. And sometimes you will find me referring to them as colorists, sometimes as chiaroscurists. By being studious of color, they are studious of division. And while the chiaroscurist devotes himself to the representation of degrees of force in one thing, unseparated light, the colorists have for their function the attainment of beauty by arrangement of the divisions of light. My first and principal reason was that they enforced, beyond all resistance, on any student who might attempt to copy them, this method of laying portions of distinct hue side by side. Some of the touches, indeed, when the tint has been mixed with much so that the pigment might crystallize hard at the edge. It is the head of a parrot with a little flower in his beak from a picture of Carpaccio's, one of his series of the life of St. George. Then he comes to the beak of it. The brown ground beneath is left for the most part. One touch of black is put for the hollow, two delicate lines of dark gray define the outer curve, and one little quivering touch of white draws the inner edge of the mandible. For, believe me, the final philosophy of art can only ratify their opinion that the beauty of a cock-robin is to be red, and of a grass plot to be green, and the best skill of art is in instantly seizing on the manifold deliciousness of light, which you can only seize by precision of instantaneous touch. Now you will see in these studies that the moment the white is enclosed properly and harmonized with the other hues, it becomes somehow more precious and pearly. than the white paper and that i am not afraid to leave a whole field of untreated white paper all round it being sure that even the little diamonds in the round window will tell as jewels if they are gradated justly but in this vignette copied from turner you have the two principles brought out perfectly they are beyond all other works that i know existing dependent for their effect on low subdued tones Their favorite choice in time of day being either dawn or twilight, and even their brightest sunsets produced chiefly out of gray paper. It may be that a great colorist will use his utmost force of color as a singer his full power of voice, but, loud or low, the virtue is in both cases always in refinement, never in loudness. It must, remember, be one or the other. think that the Gothic school is an easy one. The law of that school is that everything shall be seen clearly, or at least only in such mist or faintness as shall be delightful. And I have no doubt that the best introduction to it would be the elementary practice of painting every study on a golden ground. This at once compels you to understand that the work is to be imaginative and decorative, that it represents beautiful things in the clearest way, but not under existing conditions. and that, in fact, you are producing jeweler's work rather than pictures. That a style is restrained or severe does not mean that it is also erroneous. In all early Gothic art, indeed, you will find failure of this kind, especially distortion and rigidity, which are in many respects painfully to be compared with the splendid repose of classic art. The large letter contains, indeed, entirely feeble and ill-drawn figures. That is merely childish and failing work of an inferior hand. It is not characteristic of Gothic, or any other school. But, observe, you can only do this on one condition, that of striving also to create, in reality, the beauty which you seek in imagination. It will be wholly impossible for you to retain the tranquility of temper and felicity of faith necessary for noble, purest painting. unless you are actively engaged in promoting the felicity and peace of practical life. You must look at him in the face, fight him, conquer him, with what scathe you may. You need not think to keep out of the way of him. The colorist says, first of all, as my delicious parquet was ruby, so this nasty viper shall be black. And then is the question, can I round him off? even though he is black, and make him slimy, and yet springy and close down, clotted like a pool of black blood on the earth, all the same? Nothing will be more precious to you, I think, in the practical study of art, than the conviction, which will force itself on you more and more every hour, of the way all things are bound together, little and great, in spirit and in matter. You know I've... Just been telling you how this school of materialism and clay involved itself at last in cloud and fire. Here is an equally typical Greek school landscape by Wilson. Lost wholly in golden mist. The trees so slightly drawn that you don't know if they are trees or towers. And no care for color whatsoever. Perfectly deceptive and marvelous effect of sunshine through the mist. Apollo and the python. Now here is Raphael. exactly between the two trees still drawn leaf by leaf wholly formal but beautiful mist coming gradually into the distance well then last here is turner's greek school of the highest class and you define his art absolutely as first the displaying intensely and with the sternest intellect of natural form as it is and then the envelopment of it with cloud and fire There are two sorts of cloud and fire. He knows them both. There's one and there's another, the Dudley and the Flint. It is only a pencil outlined by Edward Byrne Jones in illustration of the story of Psyche. It is the introduction of Psyche after all her troubles sent to heaven. Every plant in the grass is set formally, grows perfectly, and may be realized completely. exquisite order and universal with eternal life and light this is the faith and effort of the schools of crystal and you may describe and complete their work quite literally by taking any verses of Chaucer in his tender mood and observing how he insists on the clearness and brightness first and then on the order thus in Chaucer's dream in both these high mythical subjects the surrounding nature those suffering is still dignified and beautiful. But now here is the subject of which you will wonder at first why Turner drew it at all. It has no beauty whatsoever, no specialty of picturesqueness, and all its lines are cramped and poor. The crampedness and the poverty are all intended. It is a gleaner bringing down her one sheaf of corn to an old watermill, itself mossy and rent, scarcely able to get its stones to turn. The scene is absolutely Arcadian. See that your lives be in nothing worse than a boy's climbing for his entangled kite.",13.627800941467285
6930-81414-0000,0.22546419098143236," no words were spoken no language was uttered save that of wailing and hissing and that somehow was indistinct as if it existed in fancy and not in reality I heard a noise behind. I turned and saw Kaffir, his black eyes shining, while in his hand he held a gleaming knife. He lifted it above his head as if to strike, but I had the strength of ten men, and I hurled him from me. Onward, said a distant voice. no sound broke the stillness of the night the story of its evil influence came back to me and in my bewildered condition i wondered whether there was not some truth in what had been said what was that what then a human hand large and shapely appeared distinctly on the surface of the pond nothing more not even the wrist to which it might be attached it did not beckon or indeed move at all it was as still as the hand of death i awoke to consciousness fighting at first it seemed as if i was fighting with the phantom but gradually my opponent became more real to me it was kaffir a sound of voices a flash of light a feeling of freedom and i was awake where said another voice which i recognized as voltaire's kaffir i had scarcely known what i had been saying or doing up to this time but as he spoke i looked at my hand in the light of the moon i saw a knife red with blood and my hand too was also discolored i do not know i am dazed bewildered but that is kaffir's knife i know he had it this very evening i remembered saying have we been together volcher picked up something from the ground and looked at it i say you do know what this means and you must tell us A terrible thought flashed into my mind. I had again been acting under the influence of this man's power. Perchance, too, Kaffir's death might serve him in good stead. My tongue refused to articulate. My power of speech left me. My position was too terrible. My overwrought nerves yielded at last. For some time after that I remembered nothing distinctly.",3.264535665512085
8463-294828-0000,0.24528301886792453," chapter three as master wishes three seconds before the arrival of j b hobson's letter i no more dreamed of chasing the unicorn than of trying for the northwest passage Even so, I had just returned from an arduous journey, exhausted and badly needing a rest. I wanted nothing more than to see my country again, my friends, my modest quarters by the botanical gardens, my dearly beloved collections. But now nothing could hold me back. Conce was my manservant. From rubbing shoulders with scientists in our little universe by the botanical gardens, the boy had come to know a thing or two. classifying was everything to him so he knew nothing else well versed in the theory of classification he was poorly versed in its practical application and I doubt that he could tell a sperm whale from a baleen whale and yet what a fine gallant lad not once did he comment on the length or the hardships of the journey never did he object to buckling up his suitcase for any country whatever china or the congo no matter how far off it was he went here there and everywhere in perfect contentment please forgive me for this underhanded way of admitting that i had turned forty he was a fanatic on formality and he only addressed me in the third person to the point where it got tiresome There was good reason to stop and think, even for the world's most emotionless man. Conseil, I called a third time. Conseil appeared. Dead master summoned me, he said, entering. Pack as much into my trunk as you can. My traveling kit, my suits, shirts, and socks. Don't bother counting. Just squeeze it all in. And hurry. We'll deal with them later. What? anyhow we'll leave instructions to ship the whole menagerie to france yes we are certainly i replied evasively but after we make a detour a route slightly less direct that's all we're leaving on the abraham lincoln you see my friend it's an issue of the monster the notorious narwhal we don't know where it will take us but we're going just the same we have a commander who's game for anything i left instructions for shipping my containers of stuffed animals and dried plants to paris france i opened a line of credits sufficient to cover the barbarossa and conseil at my heels i jumped into a carriage our baggage was immediately carried to the deck of the frigate i rushed aboard i asked for commander farragut one of the sailors led me to the afterdeck where i stood in the presence of a smart-looking officer who extended his hand to me in person welcome aboard professor your cabin is waiting for you i was well satisfied with my cabin which was located in the stern and opened into the officer's mess we'll be quite comfortable here i told conse and so if i had been delayed by a quarter of an hour or even less the frigate would have gone without me and i would have missed out on this unearthly extraordinary and inconceivable The wharves of Brooklyn and every part of New York bordering the East River were crowded with curiosity seekers. Thousands of handkerchiefs were waving above these tightly packed masses, hailing the Abraham Lincoln until it reached the waters of the Hudson River at the tip of the long peninsula that forms New York City.",5.208227634429932
7021-85628-0000,0.12368972746331237," But Anders cared nothing about that. He made a bow so deep that his back came near breaking. And he was dumbfounded, I can tell you, when he saw it was nobody but Anders. He was such a big boy that he wore high boots and carried a jackknife. Now, this knife was a splendid one, though half the blade was gone and the handle was a little cracked. And Anders knew that one is almost a man as soon as one has a jackknife. Yes, why not, thought Anders, seeing that I am so fine, I may as well go and visit the king. I am going to the court ball, answered Anders. And she took Anders' hand and walked with him up the broad marble stairs, where soldiers were posted at every third step. and through the magnificent halls where courtiers in silk and velvet stood bowing wherever he went for like as not they must have thought him a prince when they saw his fine cap at the farther end of the largest hall a table was set with golden cups and golden plates in long rows on huge silver platters were pyramids of tarts and cakes and red wine sparkled in glittering decanters the princess sat down under a blue canopy with bouquets of roses and she let anders sit in a golden chair by her side but you must not eat with your cap on your head she said and was going to take it off the princess certainly was beautiful and he would have dearly liked to be kissed by her but the cap which his mother had made he would not give up on any condition he only shook his head well but now said the princess and she filled his pockets with cakes and put her own heavy gold chain around his neck and bent down and kissed him that is a very fine cap you have he said so it is said anders and it is made of mother's best yarn and she knitted it herself, and everybody wants to get it away from me. With one jump, Anders got out of his chair. He darted like an arrow through all the halls, down all the stairs, and across the yard. He still held on to it with both hands as he rushed into his mother's cottage. And all his brothers and sisters stood round and listened with their mouths open. But when his big brother heard that he had refused to give his cap for a king's golden crown, he said that Anders was a stupid. Anders' face grew red, but his mother hugged him close. No, my little son, she said, if you dressed in silk and gold from top to toe, you could not look any nicer than in your little red cap.",3.8399782180786133
4992-41797-0000,0.2563559322033898," yes dead these four years and a good job for her too well as i say it's an awful queer world they clap all the burglars in jail and the murderers and the wife beaters i allers thought a gentle reproof would be enough punishment for a wife beater cause he probably has a lot of provocation that nobody knows and the firebugs can't think of the right name something like cendiaries and the breakers of the peace and what not and yet the law has nothing to say to a man like han lord grandfather was alexander carey ll d doctor of laws that is mr popham laid down his brush i swain to man he ejaculated if you don't work hard you can't keep up with the times doctor of laws done he ain't done a thing he ordered since he was born he keeps the thou shalt not commandments first-rate hen lord does he gave up his position and shut the family up in that tomb of a house so he could study his books mr popham exaggerated nothing but on the contrary left much unsaid in his narrative of the family at the house of lords henry lord with a degree of ph d to his credit had been professor of zoology at a new england college but had resigned his post in order to write a series of scientific textbooks. Always irritable, cold, indifferent, he had grown rapidly more so as years went on. Whatever appealed to her sense of beauty was straightway transferred to paper or canvas. She is wild to know how to do things. She makes effort after effort, trembling with eagerness, and when she fails to reproduce what she sees, she works herself into a frenzy of grief and disappointment. when she could not make a rabbit or a bird look real on paper she searched in her father's books for pictures of its bones cyril there must be some better way of doing i just draw the outline of an animal and then i put hairs or feathers on it they have no bodies they couldn't run or move they're just pasteboard he wouldn't search so don't worry replied cyril quietly and the two looked at each other and knew that it was so there in the cedar hollow then lived olive lord an angry resentful little creature weighed down by a fierce sense of injury olive's mournful black eyes meant nancy's sparkling brown ones nancy's curly chestnut crop shone in the sun and olive's thick black plates looked blacker by contrast she is wonderful more wonderful than anybody we've ever seen anywhere and she draws better than the teacher in charlestown she's older than i am but so tiny and sad and shy that she seems like a child",3.1756839752197266
1580-141083-0000,0.1652490886998785," i will endeavor in my statement to avoid such terms as would serve to limit the events to any particular place or give a clue as to the people concerned i had always known him to be restless in his manner but on this particular occasion he was in such a state of uncontrollable agitation that it was clear something very unusual had occurred my friend's temper had not improved since he had been deprived of the congenial surroundings of baker street Without his scrapbooks, his chemicals, and his homely untidiness, he was an uncomfortable man. I had to read it over carefully, as the text must be absolutely correct. I was absent rather more than an hour. The only duplicate which existed, so far as I knew, was that which belonged to my servant, Bannister, a man who has looked after my room for ten years, and whose honesty is absolutely above suspicion. The moment I looked at my table, I was aware that someone had rummaged among my papers. The proof was in three long slips. I had left them all together. The alternative was that someone passing had observed the key in the door, had known that I was out, and had entered to look at the papers. I gave him a little brandy and left him collapsed in a chair while I made a most careful examination of the room. A broken tip of lead was lying there also. not only this but on the table i found a small ball of black dough or clay with specks of something which looks like sawdust in it above all things i desire to settle the matter quietly and discreetly to the best of my belief they were rolled up did anyone know that these proofs would be there no one save the printer i was in such a hurry to come to you you left your door open so it seems to me now mr solmes at your disposal above were three students one on each story then he approached it and standing on tiptoe with his neck craned he looked into the room there is no opening except the one pane said our learned guide i am afraid there are no signs here said he one could hardly hope for any upon so dry a day you left him in a chair you say which chair by the window there the men entered and took the papers sheet by sheet from the central table as a matter of fact he could not said solmes for i entered by the side door how long would it take him to do that using every possible contraction a quarter of an hour not less then he tossed it down and seized the next he was in the midst of that when your return caused him to make a very hurried retreat very hurried since he had not time to replace the papers which would tell you that he had been there Mr. Solmes was somewhat overwhelmed by this flood of information. Holmes held out a small chip with the letters NN and a space of clear wood after them. You see? Watson, I have always done you an injustice. There are others. I was hoping that if the paper on which he wrote was thin, some trace of it might come through upon this polished surface. No, I see nothing. As Holmes drew the curtain, I was aware, from some little rigidity and an alertness of his attitude, that he was prepared for an emergency. Holmes turned away and stooped suddenly to the floor. Hello, what is this? Holmes held it out on his open palm in the glare of the electric light. What could he do? He caught up everything which would betray him, and he rushed into your bedroom to conceal himself. I understand you to say that there are three students who use this stare and are in the habit of passing your door? Yes, there are. And they are all in for this examination? Yes. One hardly likes to throw suspicion where there are no proofs. let us hear the suspicions i will look after the proofs my scholar has been left very poor but he is hard-working and industrious he will do well i dare not go so far as that but of the three he is perhaps the least unlikely he was still suffering from the sudden disturbance of the quiet routine of his life but i have occasionally done the same thing at other times did you look at these papers on the table how came you to leave the key in the door anyone in the room could get out yes sir i really don't think he knew much about it mr holmes only for a minute or so oh i would not venture to say sir you haven't seen any of them no sir",6.22620701789856
8224-274381-0000,0.16790490341753342," though thrown into prison for this enterprise and detained some time he was not discouraged but still continued by his countenance and protection to infuse spirit into the distressed royalists among other persons of distinction who united themselves to him was lord napier of murcheston son of the famous inventor of the logarithms the person to whom the title of a great man is more justly due than to any other whom his country ever produced. While the former foretold that the Scottish Covenanters were secretly forming a union with the English Parliament, and inculcated the necessity of preventing them by some vigorous that every such attempt would precipitate them into measures to which otherwise they were not perhaps inclined. The king's ears were now open to Montrose's counsels, who proposed none but the boldest and most daring, agreeably to the desperate state of the royal cause in Scotland. five hundred men more who had been levied by the covenanters were persuaded to embrace the royal cause and with this combined force he hastened to attack lord elko who lay at perth with an army of six thousand men assembled upon the first news of the irish invasion dreading the superior power of argyle who having joined his vassals to a force levied by the public was approaching with a considerable army montrose hastened northward in order to rouse again the marquis of huntly and the gordons who having before hastily taken arms had been instantly suppressed by the covenanters was very low for military prowess, and after some skirmishes in which he was worsted, he here allowed Montrose to escape him. By quick marches through these inaccessible mountains, that general freed himself from the superior forces of the Covenanters. With these, and some reinforcements of the Athol men and MacDonalds, whom he had recalled, Montrose fell suddenly upon Argyle's country, and let loose upon it all the rage of war, carrying off the cattle, burning the houses, and putting the inhabitants to the sword. This severity by which Montrose sullied his victories was the result of private animosity against the chieftain, as much as of zeal for the public cause. argyle collecting three thousand men marched in quest of the enemy who had retired with their plunder and he lay at inner locky supposing himself still at a considerable distance from them by a quick and unexpected march montrose hastened to inner locky and presented himself in order of battle before the surprised but not affrightened covenanters his conduct and presence of mind in this emergence appeared conspicuous montrose weak in cavalry here lined his troops of horse with infantry and after putting the enemy's horse to rout fell with united force upon their foot who were entirely cut in pieces though with the loss of the gallant lord gordon on the part of the royalists from the same men new regiments and new companies were formed different officers appointed and the whole military force put into such hands as the independents could rely on besides members of parliament who were excluded many officers unwilling to serve under the new generals threw up their commissions and unwarily facilitated the project of putting the army entirely into the hands of that faction though the discipline of the former parliamentary army was not contemptible a more exact plan was introduced, and rigorously executed by these new commanders. Valour, indeed, was very generally diffused over the one party as well as the other. During this period, discipline also was attained by the forces of the Parliament, but the perfection of the military art in concerting the general plans of action and the operations of the field seems still on both sides to have been in a great measure wanting historians at least perhaps from their own ignorance and inexperience have not remarked anything but a headlong impetuous conduct each party hurrying to a battle where valor and fortune chiefly determine the success",7.139776229858398
